{
  "claims": [
    {
      "description": "A concrete containing method context is bound.",
      "id": "C01",
      "kind": "node",
      "required": true,
      "slot": "context"
    },
    {
      "description": "A candidate copy/input operation is bound.",
      "id": "C02",
      "kind": "node",
      "required": true,
      "slot": "sink"
    },
    {
      "description": "The concrete destination expression is bound.",
      "id": "C03",
      "kind": "node",
      "required": true,
      "slot": "destination"
    },
    {
      "description": "The destination resolves to a concrete memory object.",
      "id": "C04",
      "kind": "node",
      "required": true,
      "slot": "target"
    },
    {
      "description": "The sink belongs to the witness method context.",
      "direction": "out",
      "id": "C05",
      "kind": "relation",
      "max_hops": 1,
      "relation": "PARENT_METHOD",
      "required": true,
      "source": "context",
      "target": "sink"
    },
    {
      "description": "The sink destination argument is the witness destination according to the semantic argument-role model.",
      "direction": "out",
      "id": "C06",
      "kind": "edge",
      "max_hops": 1,
      "relation": "CALL_ARGUMENT",
      "required": true,
      "source": "sink",
      "target": "destination"
    },
    {
      "description": "The destination expression resolves to the target object.",
      "direction": "either",
      "id": "C07",
      "kind": "relation",
      "max_hops": 3,
      "relation": "REFERENCE",
      "required": true,
      "source": "destination",
      "target": "target"
    },
    {
      "description": "Destination and target are proven to denote the same object.",
      "id": "C08",
      "kind": "same_object",
      "required": true,
      "source": "destination",
      "target": "target"
    },
    {
      "description": "The sink is a modeled memory-copy/write operation.",
      "equals": {
        "derived.memory_write_like": true
      },
      "id": "C09",
      "kind": "semantic",
      "required": true,
      "slot": "sink"
    },
    {
      "description": "Target capacity is proven.",
      "equals": {
        "derived.memory_capacity_known": true
      },
      "id": "C10",
      "kind": "semantic",
      "required": true,
      "slot": "target"
    },
    {
      "description": "Capacity and copy extent use byte units.",
      "equals": {
        "derived.capacity_unit": "BYTES"
      },
      "id": "C11",
      "kind": "semantic",
      "required": true,
      "slot": "target"
    },
    {
      "description": "Capacity has explicit derivation provenance.",
      "id": "C12",
      "kind": "property",
      "properties_present": [
        "derived.capacity_proof"
      ],
      "required": true,
      "slot": "target"
    },
    {
      "description": "Storage region is explicitly modeled.",
      "id": "C13",
      "kind": "property",
      "properties_present": [
        "derived.memory_region"
      ],
      "required": true,
      "slot": "target"
    },
    {
      "description": "The source expression is bound.",
      "id": "C14",
      "kind": "node",
      "required": true,
      "slot": "source"
    },
    {
      "description": "Source is represented as a concrete value expression.",
      "equals": {
        "derived.node_kind": "IDENTIFIER"
      },
      "id": "C15",
      "kind": "semantic",
      "required": true,
      "slot": "source"
    },
    {
      "description": "Source value reaches the destination within the same witness.",
      "id": "C16",
      "kind": "relation",
      "max_hops": 24,
      "relation": "DATA_FLOW",
      "required": true,
      "source": "source",
      "target": "destination"
    },
    {
      "description": "The sink is a formatted output operation.",
      "equals": {
        "derived.format_write_like": true
      },
      "id": "C17",
      "kind": "semantic",
      "required": true,
      "slot": "sink"
    },
    {
      "description": "The formatted write is unbounded with respect to destination size.",
      "equals": {
        "derived.unbounded_write_like": true
      },
      "id": "C18",
      "kind": "semantic",
      "required": true,
      "slot": "sink"
    },
    {
      "description": "No destination-size bound is encoded in the sink semantics.",
      "equals": {
        "derived.write_extent_mode": "UNBOUNDED"
      },
      "id": "C19",
      "kind": "semantic",
      "required": true,
      "slot": "sink"
    },
    {
      "any_of": {
        "derived.memory_region": [
          "AUTOMATIC",
          "STATIC",
          "HEAP",
          "LOCAL_OR_GLOBAL"
        ]
      },
      "description": "The target region is within the supported storage scope.",
      "id": "C20",
      "kind": "property",
      "required": true,
      "slot": "target"
    }
  ],
  "concepts": {
    "context": {
      "selectors": [
        {
          "type_any": [
            "METHOD"
          ],
          "canonical_type_any": [
            "METHOD"
          ]
        }
      ]
    },
    "destination": {
      "selectors": [
        {
          "properties": {
            "derived.argument_role": "destination"
          },
          "type_any": [
            "IDENTIFIER"
          ],
          "canonical_type_any": [
            "IDENTIFIER"
          ]
        }
      ]
    },
    "guard": {
      "selectors": [
        {
          "properties": {
            "derived.guard_safe": true
          },
          "type_any": [
            "CONTROL_STRUCTURE",
            "CALL",
            "BLOCK"
          ],
          "canonical_type_any": [
            "BLOCK",
            "CALL",
            "CONTROL"
          ]
        }
      ]
    },
    "sink": {
      "selectors": [
        {
          "name_any": [
            "sprintf",
            "vsprintf"
          ],
          "type_any": [
            "CALL"
          ],
          "canonical_type_any": [
            "CALL"
          ]
        }
      ]
    },
    "source": {
      "selectors": [
        {
          "properties": {
            "derived.argument_role": "source"
          },
          "type_any": [
            "IDENTIFIER"
          ],
          "canonical_type_any": [
            "IDENTIFIER"
          ]
        }
      ]
    },
    "target": {
      "selectors": [
        {
          "properties": {
            "derived.is_array": true
          },
          "type_any": [
            "LOCAL",
            "IDENTIFIER"
          ],
          "canonical_type_any": [
            "IDENTIFIER",
            "LOCAL"
          ]
        },
        {
          "properties": {
            "derived.allocation_like": true
          },
          "type_any": [
            "CALL"
          ],
          "canonical_type_any": [
            "CALL"
          ]
        }
      ]
    }
  },
  "counter_evidence": [
    {
      "description": "A proven safe guard dominates the vulnerable operation and refutes the candidate witness.",
      "direction": "out",
      "id": "X01",
      "kind": "relation_any",
      "max_hops": 1,
      "relation": "DOMINANCE",
      "required": false,
      "source_selector": {
        "properties": {
          "derived.guard_safe": true
        },
        "type_any": [
          "CONTROL_STRUCTURE",
          "CALL",
          "BLOCK"
        ]
      },
      "target": "sink"
    },
    {
      "description": "A proven bounded output operation refutes the unbounded-format family.",
      "equals": {
        "derived.unbounded_write_like": false
      },
      "id": "X02",
      "kind": "semantic",
      "required": false,
      "slot": "sink"
    }
  ],
  "counter_unknown_policy": "block_match",
  "coverage": {
    "minimum_hidden_cases": 60,
    "minimum_public_cases": 60,
    "required_dimensions": [
      "positive",
      "negative",
      "unknown",
      "direct",
      "interprocedural",
      "counter_evidence",
      "adversarial",
      "storage_automatic",
      "storage_static",
      "storage_heap",
      "dataflow",
      "capacity",
      "source_control"
    ],
    "requires_adversarial_mutations": true,
    "research_variants": [
      "same_function",
      "interprocedural",
      "cross_file",
      "pointer_alias",
      "static_storage",
      "heap_storage",
      "safe_bound",
      "missing_dataflow",
      "missing_capacity",
      "symbolic_range",
      "wrong_object",
      "distractor_literal",
      "guard_dominance",
      "unknown_analysis"
    ],
    "unknown_counter_dimension": true
  },
  "cwe": "CWE-120",
  "description": "Unbounded formatted output into a finite-capacity destination; proves root-cause evidence, not exact output length.. This is an Evidence Family, not a universal CWE-120 rule. A MATCH proves only the stated evidence class.",
  "language": "C/C++",
  "metadata": {
    "coherence_rule": "All required positive claims and applicable counter-evidence are evaluated against one coherent witness.",
    "evidence_definition_version": "1.0",
    "evidence_level": "ROOT_CAUSE_UNCHECKED_COPY",
    "research_question": "Which graph-observable facts are jointly sufficient to prove this CWE-120 Evidence Family while refusing unsupported conclusions?",
    "scope_boundary": "Concrete overflow is claimed only when extent/range is proven to exceed byte capacity. Unbounded families prove root-cause conditions, not concrete overflow magnitude or exploitability.",
    "storage_rule": "Storage region is a dimension, not part of CWE-120 identity; automatic/static/heap are accepted when capacity is proven.",
    "unknown_rule": "UNKNOWN never becomes MATCH and incomplete/truncated analysis cannot produce a definitive match."
  },
  "name": "Unbounded formatted output into a finite-capacity destination; proves root-cause evidence, not exact output length.",
  "pattern_id": "cwe-120-unbounded-format-output-001",
  "provenance": [
    {
      "kind": "cwe",
      "source": "MITRE CWE-120",